{
  "schemaVersion": 1,
  "repo": "florianthompson/nef-web",
  "kind": "nef-web",
  "proofKind": "ui",
  "branch": "florian/haz-163-nef-notes-mic-does-not-record-again-after-clearing-the-text",
  "commitSha": "90a367e965382aa91c67f84fa28196330f5960c9",
  "pr": {
    "url": "https://github.com/florianthompson/nef-web/pull/14",
    "number": 14,
    "state": "OPEN",
    "isDraft": true,
    "merged": false,
    "mergedAt": null
  },
  "urls": {
    "preview": "https://nef-3x9qskax1-florian-thompsons-projects-c1c41a9c.vercel.app",
    "live": null
  },
  "console": {
    "errors": []
  },
  "createdAt": "2026-10-03T17:22:18Z",
  "createdBy": "Claude Code",
  "ticket": "HAZ-163",
  "screenshots": [
    {
      "path": "mic-after-clear-cycle5-desktop.png",
      "viewport": "desktop",
      "width": 2880,
      "height": 1800,
      "deviceScaleFactor": 2,
      "route": "/app (stubbed media)"
    },
    {
      "path": "mic-after-clear-cycle5-390.png",
      "viewport": "mobile390",
      "width": 780,
      "height": 1328,
      "deviceScaleFactor": 2,
      "route": "/app (stubbed media, WebKit iPhone)"
    }
  ],
  "checks": [
    {
      "name": "unit tests (npm test)",
      "command": "npm test",
      "exitCode": 0,
      "durationMs": 1000,
      "summary": "tests 97, pass 96, fail 0, skipped 1 (recorderCore 4/4, vehicleNotes 7/7)"
    },
    {
      "name": "typecheck",
      "command": "npx tsc --noEmit",
      "exitCode": 0,
      "durationMs": 1000,
      "summary": "no errors"
    },
    {
      "name": "build",
      "command": "npm run build",
      "exitCode": 0,
      "durationMs": 1000,
      "summary": "next build ok"
    },
    {
      "name": "no dashes",
      "command": "npm run check:dashes",
      "exitCode": 0,
      "durationMs": 1000,
      "summary": "no em or en dash in UI source"
    },
    {
      "name": "mic cycles chromium 1440 and webkit 390",
      "command": "python3 proof/HAZ-163/mic_cycles.py <preview> --engine chromium|webkit --mode normal|ios-autostop",
      "exitCode": 0,
      "durationMs": 1000,
      "summary": "5 cycles PASS in all four runs, see proof/HAZ-163/cycles.txt"
    }
  ]
}