{
  "schemaVersion": 1,
  "repo": "florianthompson/nef-web",
  "kind": "nef-web",
  "proofKind": "ui",
  "branch": "florian/haz-179-nef-add-co-warner-to-the-protokoll-not-ausrustung",
  "commitSha": "c7966dc65a87ccf1aa9939b34913da76872bf583",
  "pr": {
    "url": "https://github.com/florianthompson/nef-web/pull/17",
    "number": 17,
    "state": "OPEN",
    "isDraft": true,
    "merged": false,
    "mergedAt": null
  },
  "urls": {
    "preview": "https://nef-k84iekz4o-florian-thompsons-projects-c1c41a9c.vercel.app",
    "live": null
  },
  "console": {
    "errors": []
  },
  "createdAt": "2026-10-05T08:46:50Z",
  "createdBy": "Claude Code",
  "ticket": "HAZ-179",
  "screenshots": [
    {
      "path": "protokoll-co-warner-desktop.png",
      "viewport": "desktop",
      "width": 2880,
      "height": 1800,
      "deviceScaleFactor": 2,
      "route": "/app Protokoll, CO-Warner under Fahrzeug, catalog-injected (Chromium 1440)"
    },
    {
      "path": "protokoll-co-warner-marked-desktop.png",
      "viewport": "desktop",
      "width": 2880,
      "height": 1800,
      "deviceScaleFactor": 2,
      "route": "/app Protokoll, CO-Warner under Fahrzeug, catalog-injected (Chromium 1440)"
    },
    {
      "path": "protokoll-co-warner-after-reload-desktop.png",
      "viewport": "desktop",
      "width": 2880,
      "height": 1800,
      "deviceScaleFactor": 2,
      "route": "/app Protokoll, CO-Warner under Fahrzeug, catalog-injected (Chromium 1440)"
    },
    {
      "path": "protokoll-co-warner-390.png",
      "viewport": "mobile390",
      "width": 780,
      "height": 1800,
      "deviceScaleFactor": 2,
      "route": "/app Protokoll, CO-Warner under Fahrzeug, catalog-injected (WebKit iPhone 13 (390x900))"
    },
    {
      "path": "protokoll-co-warner-marked-390.png",
      "viewport": "mobile390",
      "width": 780,
      "height": 1800,
      "deviceScaleFactor": 2,
      "route": "/app Protokoll, CO-Warner under Fahrzeug, catalog-injected (WebKit iPhone 13 (390x900))"
    },
    {
      "path": "protokoll-co-warner-after-reload-390.png",
      "viewport": "mobile390",
      "width": 780,
      "height": 1800,
      "deviceScaleFactor": 2,
      "route": "/app Protokoll, CO-Warner under Fahrzeug, catalog-injected (WebKit iPhone 13 (390x900))"
    }
  ],
  "checks": [
    {
      "name": "unit tests (npm test)",
      "command": "npm test",
      "exitCode": 0,
      "durationMs": 1000,
      "summary": "tests 108, pass 107, fail 0, skipped 1 (incl. new co_warner.test.mjs)"
    },
    {
      "name": "typecheck",
      "command": "npx tsc --noEmit",
      "exitCode": 0,
      "durationMs": 1000,
      "summary": "no errors"
    },
    {
      "name": "build",
      "command": "npm run build",
      "exitCode": 0,
      "durationMs": 1000,
      "summary": "next build ok"
    },
    {
      "name": "no dashes",
      "command": "npm run check:dashes",
      "exitCode": 0,
      "durationMs": 1000,
      "summary": "no em or en dash in UI source"
    },
    {
      "name": "eslint",
      "command": "npx eslint src/lib/items/__tests__/co_warner.test.mjs",
      "exitCode": 0,
      "durationMs": 1000,
      "summary": "no findings"
    },
    {
      "name": "migration on throwaway Postgres (pglite)",
      "command": "node proof/HAZ-179/validate_migration.mjs <snapshot> <migration>",
      "exitCode": 0,
      "durationMs": 1000,
      "summary": "8 of 8 pass: lands in Fahrzeug at position 6, idempotent, rollback removes it, 95 other items untouched; see proof/HAZ-179/migration_validation.txt"
    },
    {
      "name": "mark and reload, chromium 1440 and webkit 390",
      "command": "python3 proof/HAZ-179/show.py <preview> proof/HAZ-179",
      "exitCode": 0,
      "durationMs": 1000,
      "summary": "PASS: CO-Warner under Fahrzeug and not under Ausruestung, mark sticks after reload; CATALOG-INJECTED because the seed is not applied (PM OK), see proof/HAZ-179/run.txt"
    }
  ]
}