{
  "schemaVersion": 1,
  "repo": "florianthompson/nef-web",
  "kind": "nef-web",
  "proofKind": "ui",
  "branch": "florian/haz-166-haz-167-nef-protokoll-back-scroll-server-draft",
  "commitSha": "f9c6b6d3801e78748c16fe202c4c3a5fcefb42b1",
  "pr": {
    "url": "https://github.com/florianthompson/nef-web/pull/15",
    "number": 15,
    "state": "OPEN",
    "isDraft": true,
    "merged": false,
    "mergedAt": null
  },
  "urls": {
    "preview": "https://nef-6hsguz7d5-florian-thompsons-projects-c1c41a9c.vercel.app",
    "live": null
  },
  "console": {
    "errors": []
  },
  "createdAt": "2026-10-04T08:01:03Z",
  "createdBy": "Claude Code",
  "ticket": "HAZ-167",
  "screenshots": [
    {
      "path": "half-done-before-reload-desktop.png",
      "viewport": "desktop",
      "width": 2880,
      "height": 1800,
      "deviceScaleFactor": 2,
      "route": "/app Protokoll (Chromium 1440)"
    },
    {
      "path": "half-done-before-reload-390.png",
      "viewport": "mobile390",
      "width": 780,
      "height": 1328,
      "deviceScaleFactor": 2,
      "route": "/app Protokoll (WebKit iPhone 13)"
    },
    {
      "path": "after-reload-desktop.png",
      "viewport": "desktop",
      "width": 2880,
      "height": 1800,
      "deviceScaleFactor": 2,
      "route": "/app Protokoll (Chromium 1440)"
    },
    {
      "path": "after-reload-390.png",
      "viewport": "mobile390",
      "width": 780,
      "height": 1328,
      "deviceScaleFactor": 2,
      "route": "/app Protokoll (WebKit iPhone 13)"
    },
    {
      "path": "new-session-resumed-desktop.png",
      "viewport": "desktop",
      "width": 2880,
      "height": 1800,
      "deviceScaleFactor": 2,
      "route": "/app Protokoll (Chromium 1440)"
    },
    {
      "path": "new-session-resumed-390.png",
      "viewport": "mobile390",
      "width": 780,
      "height": 1328,
      "deviceScaleFactor": 2,
      "route": "/app Protokoll (WebKit iPhone 13)"
    }
  ],
  "checks": [
    {
      "name": "unit tests (npm test)",
      "command": "npm test",
      "exitCode": 0,
      "durationMs": 1000,
      "summary": "tests 129, pass 128, fail 0, skipped 1"
    },
    {
      "name": "typecheck",
      "command": "npx tsc --noEmit",
      "exitCode": 0,
      "durationMs": 1000,
      "summary": "no errors"
    },
    {
      "name": "build",
      "command": "npm run build",
      "exitCode": 0,
      "durationMs": 1000,
      "summary": "next build ok"
    },
    {
      "name": "no dashes",
      "command": "npm run check:dashes",
      "exitCode": 0,
      "durationMs": 1000,
      "summary": "no em or en dash in UI source"
    },
    {
      "name": "migration RLS on throwaway Postgres",
      "command": "node proof/HAZ-167/validate_migration.mjs <pglite dir>",
      "exitCode": 0,
      "durationMs": 1000,
      "summary": "13 of 13 policy checks pass, see proof/HAZ-167/migration_validation.txt"
    },
    {
      "name": "reload and new session resume, chromium 1440 and webkit 390",
      "command": "python3 proof/HAZ-167/resume.py <preview> proof/HAZ-167",
      "exitCode": 0,
      "durationMs": 1000,
      "summary": "reload resume PASS (local queue, real route 503); new session resume PASS through a STUBBED server, real server path blocked on migration OK, see proof/HAZ-167/run.txt"
    }
  ]
}
