{
  "schemaVersion": 1,
  "ticket": "HAZ-74",
  "repo": "florianthompson/nef-web",
  "kind": "nef-web",
  "branch": "haz-74-proof-json",
  "commitSha": "73493f987797a505d5af973564cb773fb9d7839e",
  "pr": {
    "url": "https://github.com/florianthompson/nef-web/pull/6",
    "number": 6,
    "state": "OPEN",
    "isDraft": false,
    "merged": false,
    "mergedAt": null
  },
  "urls": {
    "preview": "https://nef-web.vercel.app",
    "live": null
  },
  "screenshots": [
    {
      "path": "desktop-home.png",
      "viewport": "desktop",
      "width": 1440,
      "height": 3122,
      "deviceScaleFactor": 1,
      "route": "/"
    },
    {
      "path": "mobile390-home.png",
      "viewport": "mobile390",
      "width": 780,
      "height": 8194,
      "deviceScaleFactor": 2,
      "route": "/"
    }
  ],
  "checks": [
    {
      "name": "validator tests",
      "command": "node --test scripts/proof/*.test.mjs",
      "exitCode": 0,
      "durationMs": 121,
      "summary": "# Subtest: shopify-theme may omit pr and sha when repo is none\nok 17 - shopify-theme may omit pr and sha when repo is none\n  ---\n  duration_ms: 0.343299\n  type: 'test'\n  ...\n1..17\n# tests 17\n# suites 0\n# pass 17\n# fail 0\n# cancelled 0\n# skipped 0\n# todo 0\n# duration_ms 81.225234"
    }
  ],
  "console": {
    "errors": []
  },
  "createdAt": "2026-10-03T12:47:33+02:00",
  "createdBy": "Dev (Grok Bot)"
}
